0,1
4.2.4.3.2.3.1	Summary of evidence and recommendations for urethral bulking agents,
Recommendations,Strength rating
"Offer urethral bulking agents to women seeking surgical treatment for stress urinary 
incontinence (SUI) following a thorough discussion of the risks and benefits relative to other 
surgical modalities.",Strong
"Offer urethral bulking agents to women with SUI who request a low-risk procedure with the 
understanding that efficacy is lower than other surgical procedures, repeat injections are 
likely, and long-term durability and safety are not established.",Strong
"Do not offer autologous fat and hyaluronic acid as urethral bulking agents due to the higher 
risk of adverse events.",Strong
