0,1
4.1.4.1.3.1 Summary of evidence and recommendations for urinary containment,
Recommendations,Strength rating
"Ensure that women with overactive bladder (OAB) and/or their carers are informed regarding 
available treatment options before deciding on urinary containment alone.",Strong
"Offer incontinence pads and/or containment devices for management of OAB wet, either for 
temporary symptom control or when other treatments are not planned.",Strong
"Offer prophylactic antibiotics to patients on clean intermittent self-catheterisation or on 
indwelling catheter with recurrent urinary tract infection only after discussion regarding the risk 
of increasing antimicrobial resistance.",Strong
