0,1
"4.1.4.2.4	 Oestrogens
Oestrogen treatment for UI has been tested using oral, transdermal, and vaginal routes of administration. 
Vaginal (local) treatment is primarily used to treat symptoms of vaginal atrophy in postmenopausal women. 
Available evidence is related mainly to SUI, and although some reviews include participants with UUI, it is 
difficult to generalise the results to women with predominantly OAB/UUI.",
Recommendations,Strength rating
"Long-term anticholinergic treatment should be used with caution in elderly women, especially 
those who are at risk of, or have pre-existing cognitive dysfunction.",Strong
"Assess anticholinergic burden and associated co-morbidity in women being considered for 
anticholinergic therapy for overactive bladder syndrome.",Weak
