0,1
"8.3.2.5	
Guidelines for quality of life in men undergoing systemic treatments",
Recommendations,Strength rating
"Offer men on androgen deprivation therapy (ADT), 12 weeks of supervised (by trained 
exercise specialists) combined aerobic and resistance exercise.",Strong
"Advise men on ADT to maintain a healthy weight and diet, to stop smoking, reduce alcohol 
to < 2 units daily and have yearly screening for diabetes and hypercholesterolemia. Ensure 
that calcium and vitamin D meet recommended levels.",Strong
"Offer men with T1-T3 disease specialist nurse-led, multi-disciplinary rehabilitation based 
on the patients’ personal goals addressing incontinence, sexuality, depression and fear of 
recurrence, social support and positive lifestyle changes after any radical treatment.",Strong
"Offer men starting on long-term ADT dual emission X-ray absorptiometry (DEXA) scanning 
to assess bone mineral density.",Strong
"Offer anti-resorptive therapy to men on long term ADT with either a BMD T-score of < -2.5 
or with an additional clinical risk factor for fracture or annual bone loss on ADT is confirmed 
to exceed 5%.",Strong
