0,1
"11.4.3.5	
Summary of evidence and recommendations for varicocele",
Recommendations,Strength rating
"Treat varicocele in adolescents with ipsilateral reduction in testicular volume and evidence 
of progressive testicular dysfunction.",Weak
"Do not treat varicocele in infertile men who have normal semen analysis and in men with a 
sub-clinical varicocele.",Weak
"Treat infertile men with a clinical varicocele, abnormal semen parameters and otherwise 
unexplained infertility in a couple where the female partner has good ovarian reserve to 
improve fertility rates.",Strong
"Varicocelectomy may be considered in men with raised DNA fragmentation with otherwise 
unexplained infertility or who have suffered from failed of assisted reproductive techniques, 
including recurrent pregnancy loss, failure of embryogenesis and implantation.",Weak
