0,1,2,3,4
Table 9.3: Outcome of retrospective case series using cell-free tissue engineered grafts,,,,
Study,N,FU (mo),Type of graft,Patency Rate (%)
el-Kassaby et al. 2008 [531],15,25,cadaveric acellular bladder matrix,33-88
Palminteri et al. 2012 [535],30,71,porcine small intestinal submucosa,76
Xu et al. 2013 [534],28,24.8,porcine small intestinal submucosa,92
Tang et al. 2020 [533],49,15,allogeneic acellular dermal matrix,85.7
Fiala et al. 2007 [532],50,31.2,porcine small intestinal submucosa,80
