0,1
3.3.3.2.1	 Summary of evidence and recommendations for diagnostic imaging in children,
Recommendations,Strength rating
"Urgently decompress the collecting system in case of sepsis with obstructing stones, using 
percutaneous drainage or ureteral stenting.",Strong
Delay definitive treatment of the stone until sepsis is resolved.,Strong
Collect (again) urine for antibiogram test following decompression.,Strong
"Start antibiotics immediately (+ intensive care, if necessary).",Strong
Re-evaluate antibiotic regimen following antibiogram findings.,Strong
