0,1
"4.2.6	
Summary of evidence and recommendations for the management of ureteral trauma",
Summary of evidence,LE
Iatrogenic ureteral trauma is the most common cause of ureteral injury.,3
"Gunshot wounds account for the majority of penetrating ureteral injuries, while road traffic accidents 
account for most blunt injuries.",3
Ureteral trauma usually accompanies severe abdominal and pelvic injuries.,3
Haematuria is an unreliable and poor indicator of ureteral injury.,3
"Pre-operative prophylactic stents do not prevent ureteral injury; however, they may assist in its 
detection.",2
Endo-urological treatment of small ureteral fistulae and strictures is safe and effective.,3
Major ureteral injury requires ureteral reconstruction following temporary urinary diversion.,3
