0,1
"7.5.4.1	
Summary of evidence and guidelines for trimodality bladder-preserving treatment",
Recommendations,Strength rating
"Offer surgical intervention or trimodality bladder-preserving treatments (TMT) to appropriate 
candidates as primary curative therapeutic approaches since they are more effective than 
radiotherapy alone.",Strong
"Offer TMT as an alternative to selected, well-informed and compliant patients, especially for 
whom radical cystectomy is not an option or not acceptable.",Strong
